"position_id","inst_id","title","responsibilities","start_date","end_date"
"1","1","Undergraduate Learning Assistant","Facilitate student comprehension of course material by explaining complex concepts clearly. Assist in reinforcing understanding through one-on-one guidance and group discussions. Provide feedback on assignments and exams to improve student performance.","2024-08-26",None
"2","2","Malmstrom Lab Student Research Assistant"," Support ongoing research projects by conducting experiments, collecting and analyzing data, and maintaining accurate lab records.","2024-05-7",None
"3","2","Clerical Assistant","Design visually appealing flyers to communicate important information effectively. Maintain office organization by logging and processing mail, assisting in daily clerical tasks, and ensuring accurate documentation of correspondence.","2024-01-04",None
"4","3","Server","Delivered high-quality service in a fast-paced environment by taking orders efficiently and managing customer expectations. Ensured a pleasant dining experience through table preparation, setting up décor, and attentively addressing customer needs. Collaborated with kitchen staff to guarantee timely meal service.","2022-07-22","2023-11-14"
"5","4","Stocker","Managed inventory for a high-volume, multi-billion-dollar retail operation by organizing merchandise, ensuring stock accuracy, and handling overstock. Built and arranged promotional displays to enhance product visibility, contributing to increased sales. Maintained a safe, organized work environment while delivering excellent customer service.","2022-06-02","2022-08-20"
"6","5","Line Cook","Prepared a variety of dishes while adhering to health and safety standards. Worked efficiently under pressure in a high-volume kitchen, coordinating with other kitchen staff to maintain timely service. Monitored inventory and ensured food quality and presentation.","2021-06-01","2022-07-01"
